imdb_title_id,title,original_title,year,date_published,genre,duration,country,language,director,writer,production_company,actors,description,avg_vote,votes,budget,usa_gross_income,worlwide_gross_income,metascore,reviews_from_users,reviews_from_critics
tt0015136,Michael,Michael,1924,11/17/1924,"Drama, Romance",93,Germany,,Carl Theodor Dreyer,"Herman Bang, Thea von Harbou",Universum Film (UFA),"Walter Slezak, Benjamin Christensen, Nora Gregor, Alexander Murski, Grete Mosheim, Didier Aslan, Robert Garrison, Max Auzinger, Karl Freund, Wilhelmine Sandrock, Eugène de Klotz","Triangle story: painter, his young male model, unscrupulous princess.",7.1,1446,,,,,22,23
tt0015145,Monsieur Beaucaire,Monsieur Beaucaire,1924,8/11/1924,"Drama, Romance",106,USA,English,Sidney Olcott,"Booth Tarkington, Booth Tarkington",Paramount Pictures,"Rudolph Valentino, Bebe Daniels, Lois Wilson, Doris Kenyon, Lowell Sherman, Paulette Duval, John Davidson, Oswald Yorke, Flora Finch, Louis Waller, Ian Maclaren, Frank Shannon, Templar Powell, H. Cooper Cliffe, Downing Clarke","When M. Beaucaire, a handsome barber, catches the Duke of Winterset cheating at gambling, Beaucaire exacts Winterset's cooperation in sneaking Beaucaire into a great ball, disguised as the ...",5.8,439,,"$556,826 ",,,8,2
tt0015163,The Navigator,The Navigator,1924,10/13/1924,"Action, Comedy, Romance",59,USA,,"Donald Crisp, Buster Keaton","Clyde Bruckman, Joseph A. Mitchell",Buster Keaton Productions,"Buster Keaton, Kathryn McGuire, Frederick Vroom",Two spoiled rich people find themselves trapped on an empty passenger ship.,7.7,8373,"$220,000 ",,,,54,34
tt0015167,Neobychainye priklyucheniya mistera Vesta v strane bolshevikov,Neobychainye priklyucheniya mistera Vesta v strane bolshevikov,1924,4/27/1924,Comedy,94,Soviet Union,,Lev Kuleshov,"Nikolay Aseev, Vsevolod Pudovkin",Goskino,"Porfiri Podobed, Boris Barnet, Aleksandra Khokhlova, Vsevolod Pudovkin, Sergey Komarov, Leonid Obolensky, Vera Lopatina, G. Kharlampiev, Pyotr Galadzhev, S. Sletov, Viktor Latyshevskiy, Andrei Gorchilin, Vladimir Fogel","The film chronicles the adventures of an American, ""Mr. West,"" and his faithful bodyguard and servant Jeddie, as they visit the land of the horrible, evil Bolsheviks. Through various ...",6.6,827,,,,,14,10
tt0015174,Die Nibelungen: Kriemhilds Rache,Die Nibelungen: Kriemhilds Rache,1924,4/26/1924,"Adventure, Drama, Fantasy",129,Germany,,Fritz Lang,Thea von Harbou,Decla-Bioscop AG,"Margarete Schön, Gertrud Arnold, Theodor Loos, Hans Carl Mueller, Erwin Biswanger, Bernhard Goetzke, Hans Adalbert Schlettow, Hardy von Francois, Yuri Yurovsky, Iris Roberts, Rudolf Klein-Rogge, Georg John, Hubert Heinrich, Rudolf Rittner, Annie Röttgen","After Siegfried's dead, Kriemhild marries Etzel, the King of the Huns. She gives birth to a child, and invites her brothers for a party. She tries to persuade Etzel and the other Huns, that...",8,3656,,,,,18,40
tt0015175,Die Nibelungen: Siegfried,Die Nibelungen: Siegfried,1924,1924,"Adventure, Drama, Fantasy",143,Germany,German,Fritz Lang,"Fritz Lang, Thea von Harbou",Decla-Bioscop AG,"Gertrud Arnold, Margarete Schön, Hanna Ralph, Paul Richter, Theodor Loos, Hans Carl Mueller, Erwin Biswanger, Bernhard Goetzke, Hans Adalbert Schlettow, Hardy von Francois, Georg John, Frida Richard, Yuri Yurovsky, Iris Roberts, Fritz Alberti","Siegfried, son of King Sigmund, hears of the beautiful sister of Gunter, King of Worms, Kriemhild. On his way to Worms, he kills a dragon and finds a treasure, the Hort. He helps Gunther to...",8.1,4801,,,,,27,48
tt0015202,Orlacs Hände,Orlacs Hände,1924,1/31/1925,"Crime, Horror, Mystery",92,"Austria, Germany",,Robert Wiene,"Louis Nerz, Maurice Renard",Berolina Film GmbH,"Conrad Veidt, Alexandra Sorina, Fritz Strassny, Paul Askonas, Carmen Cartellieri, Hans Homma, Fritz Kortner","A world-famous pianist loses both hands in an accident. When new hands are grafted on, he doesn't know they once belonged to a murderer.",7,2008,,,,,22,24
tt0015213,Papirosnitsa ot Mosselproma,Papirosnitsa ot Mosselproma,1924,12/2/1924,"Comedy, Romance",78,Soviet Union,Russian,Yuri Zhelyabuzhsky,"Aleksei Fajko, Fyodor Otsep",Mezhrabpom-Rus,"Yuliya Solntseva, Igor Ilyinsky, Anna Dmokhovskaya, Nikolai Tsereteli, Leonid Baratov, M. Tsybulsky","As she works in her tedious office job, Maria Ivanovna dreams about being married, and she has particular hopes that her co-worker Nikodim Mityushin will take an interest in her. Nikodim, ...",6.9,125,,,,,3,2
tt0015224,Peter Pan,Peter Pan,1924,12/29/1924,"Adventure, Fantasy, Family",105,USA,,Herbert Brenon,"J.M. Barrie, Willis Goldbeck",Famous Players-Lasky Corporation,"George Ali, Esther Ralston, Cyril Chadwick, Mary Brian, Jack Murphy, Philippe De Lacy, Virginia Brown Faire, Betty Bronson, Anna May Wong, Maurice Murphy, Mickey McBan, George Crane Jr., Winston Doty, Weston Doty, Terence McMillan","Peter Pan enters the nursery of the Darling children and, with the help of fairy dust, leads them off to Never Never Land, where they meet the nefarious Captain Hook.",7.1,797,,"$630,229 ",,,21,20
tt0015268,The Red Lily,The Red Lily,1924,9/8/1924,Drama,81,USA,None,Fred Niblo,"Fred Niblo, Bess Meredyth",Metro-Goldwyn Pictures Corporation,"Ramon Novarro, Enid Bennett, Frank Currier, Mitchell Lewis, Rosita Marstini, Sidney Franklin, Wallace Beery, George Nichols, Emily Fitzroy, George Periolat, Rosemary Theby, Milla Davenport, Gibson Gowland, Dick Sutherland",Two young lovers escape their past lives to Paris until fate separates them.,7.1,397,,,,,22,4
tt0015289,Romola,Romola,1924,9/4/1925,"Drama, History",106,USA,,Henry King,"George Eliot, Will M. Ritchey",Inspiration Pictures,"Lillian Gish, Dorothy Gish, William Powell, Ronald Colman, Charles Lane, Herbert Grimwood, Bonaventura Ibáñez, Frank Puglia, Amelia Summerville, Tina Ceccaci Renaldi, Eduilio Mucci, Angela Scatigna, Ugo Uccellini, Alfredo Martinelli, Attilo Deodati","In Renaissance Florence, Tito, a no-good young man pretending to be a scholar, wins the admiration of a blind man who has long looked for someone to finish his scholarly work. He has a ...",6.4,146,,"$497,234 ",,,9,1
tt0015310,The Sea Hawk,The Sea Hawk,1924,6/14/1924,"Adventure, Drama, Romance",123,USA,English,Frank Lloyd,"Rafael Sabatini, J.G. Hawks",Frank Lloyd Productions,"Milton Sills, Enid Bennett, Lloyd Hughes, Wallace Beery, Marc McDermott, Wallace MacDonald, Bert Woodruff, Claire Du Brey, Lionel Belmore, Christina Montt, Albert Prisco, Frank Currier, William Collier Jr., Medea Radzina, Fred DeSilva",A wrongly convicted English gentleman goes from galley slave to pirate captain.,7.1,424,,"$780,187 ",,,10,7
tt0015312,Secrets,Secrets,1924,3/24/1924,Drama,108,USA,English,Frank Borzage,"Rudolph Besier, May Edginton",Joseph M. Schenck Productions,"Norma Talmadge, Eugene O'Brien, Patterson Dial, Emily Fitzroy, Claire McDowell, George Nichols, Harvey Clark, Charles Ogle, Donald Keith, Alice Day, Winston Miller, Mae Giraci, Gertrude Astor, Winter Hall, Frank Elliott","After 40 years of struggle on the Wyoming frontier, a woman reflects on her hardscrabble life with her unfaithful husband.",5.5,212,,"$470,454 ",,,3,
tt0015324,Sherlock Jr.,Sherlock Jr.,1924,5/11/1924,"Action, Comedy, Romance",45,USA,English,Buster Keaton,"Jean C. Havez, Joseph A. Mitchell",Buster Keaton Productions,"Buster Keaton, Kathryn McGuire, Joe Keaton, Erwin Connelly, Ward Crane","A film projectionist longs to be a detective, and puts his meagre skills to work when he is framed by a rival for stealing his girlfriend's father's pocketwatch.",8.2,35132,,"$977,375 ",,,302,64
tt0015361,Stachka,Stachka,1925,4/28/1925,Drama,82,Soviet Union,,Sergei M. Eisenstein,"Grigoriy Aleksandrov, Sergei M. Eisenstein",Goskino,"Maksim Shtraukh, Grigoriy Aleksandrov, Mikhail Gomorov, I. Ivanov, Ivan Klyukvin, Aleksandr Antonov, Yudif Glizer, Anatoliy Kuznetsov, Vera Yanukova, Vladimir Uralskiy, M. Mamin, Boris Yurtsev",A group of oppressed factory workers go on strike in pre-revolutionary Russia.,7.6,6434,,,,,38,32
tt0015400,The Thief of Bagdad,The Thief of Bagdad,1924,4/11/1924,"Adventure, Family, Fantasy",155,USA,,Raoul Walsh,"Lotta Woods, Douglas Fairbanks",Douglas Fairbanks Pictures,"Douglas Fairbanks, Snitz Edwards, Charles Belcher, Julanne Johnston, Sôjin Kamiyama, Anna May Wong, Brandon Hurst, Tote Du Crow, Noble Johnson",A recalcitrant thief vies with a duplicitous Mongol ruler for the hand of a beautiful princess.,7.8,5141,"$1,135,654 ",,,,57,62
tt0015493,The White Shadow,The White Shadow,1924,10/13/1924,Drama,82,UK,English,Graham Cutts,"Alfred Hitchcock, Michael Morton","Balcon, Freedman & Saville","Betty Compson, Clive Brook, Henry Victor, A.B. Imeson, Olaf Hytten, Daisy Campbell, Bert Darley, Maresco Marisini, Donald Searle, Muriel Gregory",In Paris a wild girl becomes possessed by the soul of her twin who died to save her life.,6.3,189,,,,,9,5
tt0015498,Wild Oranges,Wild Oranges,1924,1/20/1924,"Drama, Romance",88,USA,English,King Vidor,"Joseph Hergesheimer, King Vidor",Goldwyn Pictures Corporation,"Frank Mayo, Virginia Valli, Ford Sterling, Nigel De Brulier, Charles A. Post","Millie Stope lives with her grandfather on a remote island. Her grandfather fled there for political reasons. But they're not alone. An escaped prisoner, Nicholas, is terrorizing them, and ...",6.8,417,,,,,16,5
tt0015500,Wine of Youth,Wine of Youth,1924,9/15/1924,"Comedy, Drama",72,USA,English,King Vidor,"Rachel Crothers, Carey Wilson",Metro-Goldwyn Pictures Corporation,"Eleanor Boardman, James Morrison, Johnnie Walker, Niles Welch, Creighton Hale, Ben Lyon, William Haines, William Collier Jr., Pauline Garon, Eulalie Jensen, E.J. Ratcliffe, Gertrude Claire, Robert Agnew, Lucille Hutton, Virginia Lee Corbin","Unlike earlier generations of Marys who used every trickery to secure husbands, Mary the Third questions the validity of marriage in her search for adventure. Unable to decide between quiet...",6,301,,,,,2,1
tt0015518,Yolanda,Yolanda,1924,9/15/1924,Romance,74,USA,English,Robert G. Vignola,"Charles Major, Luther Reed",Cosmopolitan Productions,"Marion Davies, Lyn Harding, Holbrook Blinn, Macklyn Arbuckle, Johnny Dooley, Arthur Donaldson, Ralph Graves, Ian Maclaren, Gustav von Seyffertitz, Theresa Maxwell Conover, Martin Faust, Thomas Findley, Paul McAllister, Leon Errol, Mary Kennedy","Princess Mary of Burgundy, traveling in disguise using the name of Yolanda, attends a silk fair and falls in love with Maximilian, who has disguised himself as a knight. Later Maximilian is...",6.1,123,,,,,1,1
tt0015532,Die Abenteuer des Prinzen Achmed,Die Abenteuer des Prinzen Achmed,1926,1928,"Animation, Adventure, Fantasy",81,Germany,None,"Lotte Reiniger, Carl Koch",,Comenius-Film GmbH,,"A handsome prince rides a flying horse to faraway lands and embarks on magical adventures, which include befriending a witch, meeting Aladdin, battling demons and falling in love with a princess.",7.8,4872,,,"$100,156 ",,44,44
tt0015624,The Big Parade,The Big Parade,1925,1926,"Drama, Romance, War",151,USA,,"King Vidor, George W. Hill","Laurence Stallings, Harry Behn",Metro-Goldwyn-Mayer (MGM),"John Gilbert, Renée Adorée, Hobart Bosworth, Claire McDowell, Claire Adams, Robert Ober, Tom O'Brien, Karl Dane, Rosita Marstini",A young American soldier witnesses the horrors of the Great War.,7.9,5839,"$245,000 ",,,,53,53
tt0015634,Body and Soul,Body and Soul,1925,11/9/1925,Drama,102,USA,English,Oscar Micheaux,"Oscar Micheaux, Oscar Micheaux",Micheaux Film,"Paul Robeson, Marshall Rogers, Lawrence Chenault, Chester A. Alexander, Walter Cornick, Lillian Johnson, Madame Robinson","A minister is malevolent and sinister behind his righteous facade. He consorts with, and later extorts from, the owner of a gambling house, and betrays an honest girl, eventually driving ...",6.2,618,,,,,13,12
tt0015643,Braveheart,Braveheart,1925,12/27/1925,Western,71,USA,English,Alan Hale,"Elmer Harris, Mary O'Hara",Cinema Corporation of America,"Rod La Rocque, Lillian Rich, Robert Edeson, Arthur Housman, Frank Hagney, Jean Acker, Tyrone Power Sr., Sally Rand, Henry Victor, Nipo T. Strongheart","Chief Standing Rock's tribe has a treaty protecting their fishing grounds, but a canning corporation is violating the treaty through intimidation and force. The tribe is divided as to how ...",7,174,,,,,2,
tt0015648,Bronenosets Potemkin,Bronenosets Potemkin,1925,12/24/1925,"Drama, History, Thriller",75,Soviet Union,Russian,Sergei M. Eisenstein,Nina Agadzhanova,Goskino,"Aleksandr Antonov, Vladimir Barskiy, Grigoriy Aleksandrov, Ivan Bobrov, Mikhail Gomorov, Aleksandr Levshin, N. Poltavtseva, Konstantin Feldman, Prokhorenko, A. Glauberman, Beatrice Vitoldi, Daniil Antonovich, Iona Biy-Brodskiy, Julia Eisenstein, Sergei M. Eisenstein","In the midst of the Russian Revolution of 1905, the crew of the battleship Potemkin mutiny against the brutal, tyrannical regime of the vessel's officers. The resulting street demonstration in Odessa brings on a police massacre.",8,49221,,"$51,198 ","$61,389 ",,198,79
tt0015684,The Circle,The Circle,1925,9/22/1925,Drama,71,USA,English,Frank Borzage,"Kenneth B. Clarke, W. Somerset Maugham",Metro-Goldwyn-Mayer (MGM),"Eleanor Boardman, Malcolm McGregor, Alec B. Francis, Eugenie Besserer, George Fawcett, Creighton Hale, Otto Hoffman, Eulalie Jensen, Buddy Smith, Joan Crawford, Frank Braidwood, Derek Glynne","Elizabeth Cheney has a wealthy husband, social prominence and everything she could want in life . . . except Ted Lutton, the man she loves. Now, she must decide whether to give up ...",6.3,479,,,,,12,4
tt0015687,Clash of the Wolves,Clash of the Wolves,1925,11/28/1925,"Adventure, Romance, Western",74,USA,English,Noel M. Smith,Charles Logue,Warner Bros.,"Rin Tin Tin, Nanette, Charles Farrell, June Marlowe, Heinie Conklin, Will Walling, Pat Hartigan","A fire in the mountains drive a wolf pack into the nearby desert where they terrorize the local residents. The leader of the wolf pack is Lobo, actually a halfbreed (Rin Tin Tin). When the ...",6.6,227,,,,,6,4
tt0015693,Cobra,Cobra,1925,11/30/1925,"Drama, Romance",70,USA,English,Joseph Henabery,"Martin Brown, Anthony Coldeway",Ritz-Carlton Pictures,"Rudolph Valentino, Nita Naldi, Casson Ferguson, Gertrude Olmstead, Hector V. Sarno, Claire de Lorez, Eileen Percy, Lillian Langdon, Henry A. Barrows, Rosa Rosanova","A penniless, skirt-chasing Italian nobleman finds love and scandal when he travels to New York City.",6.4,660,,,,,12,4
tt0015758,Don Q Son of Zorro,Don Q Son of Zorro,1925,6/15/1925,"Adventure, Romance",111,USA,English,Donald Crisp,"Kate Prichard, Hesketh Prichard",Elton Corporation,"Mary Astor, Jack McDonald, Donald Crisp, Stella De Lanti, Warner Oland, Jean Hersholt, Albert MacQuarrie, Lottie Pickford, Charles Stevens, Tote Du Crow, Martha Franklin, Juliette Belanger, Roy Coulson, Enrique Acosta, Douglas Fairbanks","Don Cesar, son of Zorro, is framed for murder while visiting Spain, and becomes the whip-wielding outlaw Don Q.",7,384,,,,,10,7
tt0015768,Du skal ære din hustru,Du skal ære din hustru,1925,10/5/1925,Drama,111,Denmark,Danish,Carl Theodor Dreyer,"Carl Theodor Dreyer, Svend Rindom",Palladium Film,"Johannes Meyer, Astrid Holm, Karin Nellemose, Mathilde Nielsen, Petrine Sonne, Clara Schønfeld, Johannes Nielsen, Aage Hoffman, Viggo Lindstrøm, Vilhelm Petersen, Byril Harvig, Aage Schmidt, Frk. Voss-Christensen, Georg Busch, Frank Henriksen","When a man becomes tyrannical towards his family, the women of the house decide to teach him a lesson in gratitude.",7.1,1562,,,,,19,25
tt0015772,The Eagle,The Eagle,1925,11/8/1925,"Action, Comedy, Drama",73,USA,English,Clarence Brown,"Alexander Pushkin, George Marion Jr.",Art Finance Corporation,"Rudolph Valentino, Vilma Bánky, Louise Dresser, Albert Conti, James A. Marcus, George Nichols, Carrie Clark Ward","A wanted Russian lieutenant becomes a masked vigilante seeking vengeance upon the man who stole his family's land, only to fall for his charming daughter.",6.6,1584,,"$323,150 ",,,28,13
tt0015794,Le fantôme du Moulin-Rouge,Le fantôme du Moulin-Rouge,1925,3/13/1925,"Drama, Fantasy",90,France,,René Clair,"René Clair, Walter Schlee",Films René Fernand,"Albert Préjean, Sandra Milovanoff, Paul Ollivier, Madeleine Rodrigue, Georges Vaultier, Maurice Schutz, José Davert","A man goes to the lonely estate of the mysterious Dr. Renault, whose strange experiments release the man's spirit from his body.",6.3,123,,,,,5,1
tt0015801,Feu Mathias Pascal,Feu Mathias Pascal,1926,2/12/1926,Drama,170,France,French,Marcel L'Herbier,"Marcel L'Herbier, Luigi Pirandello",Cinégraphic,"Ivan Mozzhukhin, Marcelle Pradot, Lois Moran, Marthe Mellot, Pauline Carton, Irma Perrot, Mireille Barsac, Michel Simon, Isaure Douvan, Pierre Batcheff, Georges Térof, Philippe Hériat, Jean Hervé, Solange Sicard","Mathias Pascal, only son of a once rich family, marries beautiful Romilde, who has a terrible mother-in-law. She controls her daughter, and soon his home life becomes a nightmare, as well ...",7.1,293,,,,,6,7
tt0015841,The Freshman,The Freshman,1925,9/20/1925,"Comedy, Family, Romance",77,USA,English,"Fred C. Newmeyer, Sam Taylor","Sam Taylor, Ted Wilde",The Harold Lloyd Corporation,"Harold Lloyd, Jobyna Ralston, Brooks Benedict, James H. Anderson, Hazel Keener, Joseph Harrington, Pat Harmon",A nerdy college student will do anything to become popular on campus.,7.5,4669,,"$1,392 ",,,35,39
tt0015842,Die freudlose Gasse,Die freudlose Gasse,1925,3/22/1926,Drama,125,Germany,German,Georg Wilhelm Pabst,"Hugo Bettauer, F.H. Lyon",Sofar-Film,"Asta Nielsen, Greta Garbo, Ágnes Eszterházy, Werner Krauss, Henry Stuart, Einar Hanson, Gregori Chmara, Karl Etlinger, Ilka Grüning, Jaro Fürth, Dorothea Thiele","Vienna in the biggest depression, directly after WW1. In a slum, Lila Leid, the wife of lawyer Leid is murdered, Egon, secretary of one of Leid's clients is arrested. He was with her, and ...",7.2,1299,,,,,17,17
tt0015861,Glomdalsbruden,Glomdalsbruden,1926,1/1/1926,"Drama, Romance",115,"Norway, Sweden",,Carl Theodor Dreyer,"Jacob Breda Bull, Carl Theodor Dreyer",Victoria Film,"Einar Sissener, Tove Tellback, Stub Wiberg, Harald Stormoen, Alfhild Stormoen, Oscar Larsen, Einar Tveito, Rasmus Rasmussen, Sofie Reimers, Julie Lampe, Henny Skjønberg","Tore takes over the rundown family farm. Applying his youthful energy, he intends to make it into a big farm like Glomgården on the other side of the river, where beautiful Berit lives. ...",6.6,387,,,,,2,3
tt0015863,Go West,Go West,1925,11/1/1925,"Comedy, Western",69,USA,English,Buster Keaton,"Buster Keaton, Lex Neal",Buster Keaton Productions,"Howard Truesdale, Kathleen Myers, Ray Thompson, Brown Eyes, Buster Keaton",With little luck at keeping a job in the city a New Yorker tries work in the country and eventually finds his way leading a herd of cattle to the West Coast.,7.2,3490,,,,,22,28
tt0015864,The Gold Rush,The Gold Rush,1925,7/13/1925,"Adventure, Comedy, Drama",95,USA,English,Charles Chaplin,Charles Chaplin,Charles Chaplin Productions,"Charles Chaplin, Mack Swain, Tom Murray, Henry Bergman, Malcolm Waite, Georgia Hale",A prospector goes to the Klondike in search of gold and finds it and more.,8.2,91960,"$923,000 ",,"$26,916 ",,175,121
tt0015872,The Goose Woman,The Goose Woman,1925,12/27/1925,Drama,80,USA,English,Clarence Brown,"Rex Beach, Dwinelle Benthall",Universal Pictures,"Jack Pickford, Louise Dresser, Constance Bennett, Marc McDermott, Spottiswoode Aitken, James O. Barrows, George Nichols, Gustav von Seyffertitz, George Cooper, Kate Price","A famous opera singer lost her voice when her son was born, and has drowned her sorrows in drink. When a murder is committed near her house, she invents a story in order to get herself back...",7,138,,,,,6,3
tt0015881,Greed,Greed,1924,1/26/1925,"Drama, Thriller, Western",140,USA,English,Erich von Stroheim,"June Mathis, Erich von Stroheim",Metro-Goldwyn Pictures Corporation,"Zasu Pitts, Gibson Gowland, Jean Hersholt, Dale Fuller, Tempe Pigott, Sylvia Ashton, Chester Conklin, Joan Standing",The sudden fortune won from a lottery fans such destructive greed that it ruins the lives of the three people involved.,8.1,8439,"$546,883 ",,,,84,49
tt0015883,Gribiche,Gribiche,1926,4/2/1926,Drama,113,France,French,Jacques Feyder,"Frédéric Boutet, Jacques Feyder",Films Albatros,"Jean Forest, Rolla Norman, Françoise Rosay, Cécile Guyon, Alice Tissot, Charles Barrois, Victor Vina, Andrée Canti, Hubert Daix, Sylviane de Castillo, Armand Dufour, Major Heitner, Serge Otto, Pionnier, Maurice Soufflot",A sincere working-class 13-year old in France is adopted by a well-meaning philanthropic millionairess from America -- who promises his doting mother that the boy will have the finest education -- but things are not so simple.,6.9,206,,,,,2,7
tt0015909,Her Sister from Paris,Her Sister from Paris,1925,8/2/1925,Comedy,70,USA,English,Sidney Franklin,"Ludwig Fulda, Hanns Kräly",Joseph M. Schenck Productions,"Constance Talmadge, Ronald Colman, George K. Arthur, Gertrude Claire","A housewife poses as her sister, a notorious dancer, in order to fool her husband and teach him a lesson.",6.5,143,,"$230,306 ",,,7,1
tt0015935,El húsar de la muerte,El húsar de la muerte,1925,11/24/1925,"Biography, Drama, History",65,Chile,,Pedro Sienna,"Pedro Sienna, Hugo Silva",Film Andes S.A.,"Pedro Sienna, Clara Werther, Piet Van Ravenstein, Guillermo Barrientos, María de Hannig, Dolores Anziani, Hugo Silva, Luis Baeza, Octavio Soto, Federico Geimza, Emilia Sierra, Víctor Véjar",The story of Manuel Rodriguez,6.7,101,,,,,4,3
tt0016004,Lady Windermere's Fan,Lady Windermere's Fan,1925,9/17/1926,Comedy,120,USA,English,Ernst Lubitsch,"Oscar Wilde, Julien Josephson",Warner Bros.,"Ronald Colman, May McAvoy, Bert Lytell, Irene Rich, Edward Martindel, Carrie Daumery","A society woman believes her husband is having an affair, a misconception which may have dire personal consequences for all involved.",7.3,921,"$320,000 ",,,,15,11
tt0016005,Lady of the Night,Lady of the Night,1925,2/23/1925,"Drama, Romance",70,USA,English,Monta Bell,"Adela Rogers St. Johns, Alice D.G. Miller",Metro-Goldwyn Pictures Corporation,"Norma Shearer, Malcolm McGregor, Dale Fuller, George K. Arthur, Fred Esmelton, Lew Harvey, Gwen Lee, Betty Morrissey",A world-weary prostitute yearns after respectability and the love of an inventor.,6.6,519,,"$205,550 ",,,19,4
tt0016006,The Lady,The Lady,1925,2/8/1925,Drama,96,USA,,Frank Borzage,"Martin Brown, Frances Marion",Norma Talmadge Film Corporation,"Norma Talmadge, Wallace MacDonald, Brandon Hurst, Alfred J. Goulding, Doris Lloyd, Johnny Fox, Paulette Duval, Emily Fitzroy, Margaret Seddon, Miles McCarthy, Marc McDermott, George Hackathorne, Walter Long","A young woman marries the wastrel son of a British aristocrat. Her husband, who has been disinherited by his father, loses what little money he has left gambling in casinos and then dies, ...",5.2,120,,"$190,048 ",,,3,2
tt0016013,Lazybones,Lazybones,1925,11/6/1925,"Action, Comedy, Drama",80,USA,English,Frank Borzage,"Owen Davis, Frances Marion",Fox Film Corporation,"Madge Bellamy, Buck Jones, Zasu Pitts, Leslie Fenton, Jane Novak, Virginia Marshall, Edythe Chapman, Emily Fitzroy, William Bailey","Steve Tuttle, the titular lazybones, takes on the responsibility of raising a fatherless girl, causing a scandal in his small town. Many years later, having returned from World War I, he ...",7.2,457,,,,,11,6
tt0016023,Lights of Old Broadway,Lights of Old Broadway,1925,11/1/1925,"Drama, Romance",70,USA,English,Monta Bell,"Laurence Eyre, Joseph Farnham",Cosmopolitan Productions,"Marion Davies, Conrad Nagel, Frank Currier, George K. Arthur, Charles McHugh, Eleanor Lawson, Julia Swayne Gordon, Matthew Betz, Wilbur Higby, Bodil Rosing, George Bunny, George Harris, Bernard Berger, J. Frank Glendon, Buck Black","Lights of Old Broadway (1925) is a drama film directed by Monta Bell, produced by William Randolph Hearst's Cosmopolitan Productions, and released by Metro-Goldwyn-Mayer. The film stars ...",6,442,,,,,1,
tt0016028,Little Annie Rooney,Little Annie Rooney,1925,10/18/1925,"Drama, Comedy",94,USA,"English, Greek",William Beaudine,"Mary Pickford, Hope Loring",Mary Pickford Company,"Mary Pickford, William Haines, Walter James, Gordon Griffith, Carlo Schipa, Spec O'Donnell, Hugh Fay, Vola Vale, Joe Butterworth, Oscar Rudolph","The tenements are home to an international community, including the friends and family of a tough young ragamuffin named Annie Rooney, but their neighborhood may be threatened by a dangerous street gang.",6.7,854,,"$1,100,000 ",,,16,5
tt0016029,The Little Colonel,The Little Colonel,1935,2/22/1935,"Comedy, Family, Musical",81,USA,English,David Butler,"William M. Conselman, William M. Conselman",Fox Film Corporation,"Shirley Temple, Lionel Barrymore, Evelyn Venable, John Lodge, Sidney Blackmer, Stephen Chase, William Burress, Frank Darien, Robert Warwick, Hattie McDaniel, Geneva Williams, Avonne Jackson, Nyanza Potts, Bill Robinson","After Southern belle Elizabeth Lloyd runs off to marry Yankee Jack Sherman, her father, a former Confederate colonel during the Civil War, vows to never speak to her again. Several years ...",7.1,1259,,,,,17,4
tt0016039,The Lost World,The Lost World,1925,10/16/1925,"Adventure, Fantasy, Sci-Fi",106,USA,,Harry O. Hoyt,"Arthur Conan Doyle, Marion Fairfax",First National Pictures,"Bessie Love, Lewis Stone, Wallace Beery, Lloyd Hughes, Alma Bennett, Arthur Hoyt, Margaret McWade, Bull Montana, Frank Finch Smiles, Jules Cowles, George Bunny, Charles Wellesley, Jocko the Monkey, Arthur Conan Doyle",The first film adaptation of Sir Arthur Conan Doyle's classic novel about a land where prehistoric creatures still roam.,7,4307,,"$1,194,450 ","$2,834,000 ",,80,62
